Num	past_a	pres_a	past_b	pres_b	form	def
1301	وَرَّط	يوَرَّط	ورط	يورط	2	to get someone in trouble, to embroil, involve
1302	وَرَّم	يوَرَّم	ورم	يورم	2	to cause to swell
1303	وَرّى	يوَرّي	ورى	يوري	2	to show
1304	وَزَّع	يوَزَّع	وزع	يوزع	2	to divide up, distribute, share out
1305	وَزَّن	يوَزَّن	وزن	يوزن	2	to weigh (rural speech?)
1306	وَسَّخ	يوَسَّخ	وسخ	يوسخ	2	to soil, dirty
1307	وَسَّع	يوَسَّع	وسع	يوسع	2	to extend, expand, enlarge, to let out (clothes)
1308	وَشَّم	يوَشَّم	وشم	يوشم	2	to tattoo
1309	وَصَّل	يوَصَّل	وصل	يوصل	2	to take, bring, convey, give a lift
1310	وَصّى	يوَصّي	وصى	يوصي	2	to recomment, prescribe, to command, ask/tell (to do sth), to order (restaurant etc)
1311	وَضَّح	يوَضَّح	وضح	يوضح	2	to explain, clarify, clear up
1312	وَطَّن	يوَطَّن	وطن	يوطن	2	to settle (trans), cause (someone) to become sedentary
1313	وَطّى	يوَطّي	وطى	يوطي	2	to lower, bow (trans), bend down (intrans)
1314	وَظَّف	يوَظَّف	وظف	يوظف	2	to employ, to invest
1315	وَعّى	يوَعّي	وعى	يوعي	2	to wake someone up, to warn
1316	وَفَّر	يوَفَّر	وفر	يوفر	2	to save up, economize
1317	وَفَّق	يوَفَّق	وفق	يوفق	2	to reconcile, accommodate, cause (someone) to succeed (of God)
1318	وَقَّع	يوَقَّع	وقع	يوقع	2	to knock down, knock over, drop
1319	وَقَّف	يوَقَّف	وقف	يوقف	2	to stop (trans), end (trans), to turn off, to pull up, stop (intrans), to stand (trans and intrans), to stand still, to park (trans and intrans), to arrest, detain, hold
1320	وَلَّد	يوَلَّد	ولد	يولد	2	to generate, produce, to deliver a baby, assist in childbirth
1321	وَلَّع	يوَلَّع	ولع	يولع	2	to light, kindle, set fire to, to catch fire
1322	آخَز	يأَخَز	اخز	ياخز	3	to censure, condemn, blame, resent, be offended
1323	آمَن	يآمَن	امن	يامن	3	to believe
1324	آنَس	يآنَس	انس	يانس	3	to keep someone company
1325	بادَر	يبادَر	بادر	يبادر	3	to take an/the initiative
1326	بارَك	يبارَك	بارك	يبارك	3	to bless, congratulate
1327	بالَغ	يبالَغ	بالغ	يبالغ	3	to exaggerate
1328	تابَع	يتابَع	تابع	يتابع	3	to follow, to continue
1329	تاجَر	يتاجَر	تاجر	يتاجر	3	to trade, deal, do business
1330	جابى	يِجابي	جابى	يجابي	3	to collect, levy (taxes)
1331	جازَف	يجازَف	جازف	يجازف	3	to take risks, to gamble
1332	جازى	يجازي	جازى	يجازي	3	to give someone what they deserve, to reward, to punish
1333	جاكَر	يجاكَر	جاكر	يجاكر	3	to contradict deliberately, to annoy, to tease
1334	جامَع	يجامَع	جامع	يجامع	3	to have sex with
1335	جاوَب	يجاوَب	جاوب	يجاوب	3	to answer
1336	حارَب	يحارَب	حارب	يحارب	3	to fight (against), combat, wage war on
1337	حاصَر	يحاصَر	حاصر	يحاصر	3	to besiege
1338	حاضَر	يحاضَر	حاضر	يحاضر	3	to lecture
1339	حافَظ	يحافَظ	حافظ	يحافظ	3	to maintain, preserve, keep, observe
1340	حاكى	يحاكي	حاكى	يحاكي	3	to talk to, address
1341	حاوَل	يحاوَل	حاول	يحاول	3	to try, attempt
1342	خاطَر	يخاطَر	خاطر	يخاطر	3	to risk
1343	خالَط	يخالَط	خالط	يخالط	3	to mingle with, mix with, to come into contact with
1344	خالَف	يخالَف	خالف	يخالف	3	to oppose, differ, disagree with, to contravene, break (the law)
1345	خاوَز	يخَوَز	خاوز	يخوز	3	to treat preferentially, to favor
1346	خَايَل	يخايَل	خايل	يخايل	3	to be transparent
1347	دارى	يداري	دارى	يداري	3	to conceal, hide, cover up, protect, watch over, look out for
1348	دافَع	يدافَع	دافع	يدافع	3	to protect, defend
1349	داوَم	يداوَم	داوم	يداوم	3	to work (fixed, regular hours)
1350	دايَق	يدايَق	دايق	يدايق	3	to bother, irritate, harass
1351	دايَن	يدايَن	داين	يداين	3	to lend (money)
1352	راجَع	يراجَع	راجع	يراجع	3	to consult, apply to, to revise, go over, check, to repeat, look back on, to rehearse, to vomit
1353	راعى	يراعي	راعى	يراعي	3	to consider, respect, treat well, be pleasant to
1354	رافَق	يرافَق	رافق	يرافق	3	to accompany
1355	راقَب	يراقَب	راقب	يراقب	3	to supervise, monitor, check up on, keep an eye on, to censor
1356	راهَن	يراهَن	راهن	يراهن	3	to bet, to wager
1357	زاقى	يزاقي	زاقى	يزاقي	3	to creak, to squeak
1358	ساعَد	يساعَد	ساعد	يساعد	3	to help
1359	سافَر	يسافَر	سافر	يسافر	3	to travel, set out, go, leave
1360	سامَح	يسامَح	سامح	يسامح	3	to forgive
1361	ساهَم	يساهَم	ساهم	يساهم	3	to contribute, help out, do your bit, participate
1362	ساوى	يساوي	ساوى	يساوي	3	to arrange, fix, mend, repair, straighten out, to do
1363	سايَر	يسايَر	ساير	يساير	3	to be accommodating, be amenable, be considerate
1364	شارَط	يشارَط	شارط	يشارط	3	to impose a condition, make something conditional upon, to bet, to wager
1365	شاغَب	يشاغَب	شاغب	يشاغب	3	to cause trouble, cause a disturbance
1366	شاهَد	يشاهَد	شاهد	يشاهد	3	to watch, observe, view, look at
1367	شاوَر	يشاوَر	شاور	يشاور	3	to consult, ask for advice
1368	صاحَب	يصاحَب	صاحب	يصاحب	3	to befriend, make a friend
1369	صادَر	يصادَر	صادر	يصادر	3	to confiscate, impound, expropriate
1370	صادَف	يصادَف	صادف	يصادف	3	to run into, come across, meet by chance
1371	صادَق	يصادَق	صادق	يصادق	3	to approve, authorize, sanction, ratify
1372	صاصى	يصاصي	صاصى	يصاصي	3	to cheep, chirp
1373	صالَح	يصالَح	صالح	يصالح	3	to make up with, become reconciled with, make peace with
1374	ضارَب	يضارَب	ضارب	يضارب	3	to speculate
1375	ضايَن	يضايَن	ضاين	يضاين	3	to last, to hold out, to stick to
1376	طارَد	يطارَد	طارد	يطارد	3	to follow, pursue, to stalk, harrass
1377	عادى	يعادي	عادى	يعادي	3	to be hostile
1378	عارَض	يعارَض	عارض	يعارض	3	to oppose, disagree
1379	عاشَر	يعاشَر	عاشر	يعاشر	3	to associate with, be in contact with
1380	عافى	يعافي	عافى	يعافي	3	to restore health, to keep someone healthy
1381	عاقَب	يعاقَب	عاقب	يعاقب	3	to punish
1382	عالَج	يعالَج	عالج	يعالج	3	to treat, take care of
1383	عامَل	يعامَل	عامل	يعامل	3	to treat, behave towards
1384	عانَد	يعانَد	عاند	يعاند	3	to resist (someone) stubbornly, to argue with (someone) persistently
1385	عانى	يعاني	عانى	يعاني	3	to suffer
1386	عاوَد	يعاوَد	عاود	يعاود	3	to repeat, do again
1387	عاوَن	يعاوَن	عاون	يعاون	3	to help
1388	عايَد	يعايَد	عايد	يعايد	3	to wish someone happy (religious?) holidays
1389	عايَر	يعايَر	عاير	يعاير	3	to embarras, cause to feel ashamed, make fun of, mock
1390	غازَل	يغازَل	غازل	يغازل	3	to court
1391	غاوَز	يغاوَز	غاوز	يغاوز	3	to treat preferentially, to favor
1392	فاتَح	يفاتَح	فاتح	يفاتح	3	to start talking to, get into a conversation with, bring up a subject
1393	فاجَئ	يفاجَئ	فاجي	يفاجي	3	to surprise
1394	فاصَل	يفاصَل	فاصل	يفاصل	3	to bargain
1395	فاقَس	يفاقَس	فاقس	يفاقس	3	to bump (easter) eggs together (traditional festive children's game)
1396	قابَل	يقابَل	قابل	يقابل	3	to interview, have a meeting with
1397	قارَن	يقارَن	قارن	يقارن	3	to compare, draw a comparison
1398	قاصَص	يقاصَص	قاصص	يقاصص	3	to punish (usually within home/school)
1399	قاطَع	يقاطَع	قاطع	يقاطع	3	to boycott, shun
1400	قاقى	يقاقي	قاقى	يقاقي	3	to cluck
1401	قاهَر	يقاهَر	قاهر	يقاهر	3	to bother, annoy, harass
1402	قَاوَم	يقاوَم	قاوم	يقاوم	3	to withstand, resist, oppose
1403	كافَئ	يكافَئ	كافي	يكافي	3	to recompense, reward
1404	كافَح	يكافَح	كافح	يكافح	3	to combat, fight (against), wage war on
1405	كافى	يكافي	كافى	يكافي	3	to reward, recompense
1406	لاحَظ	يلاحَظ	لاحظ	يلاحظ	3	to notice, observe, percieve
1407	لاحَق	يلاحَق	لاحق	يلاحق	3	to follow, trail, pursue, chase
1408	لاقى	يلاقي	لاقى	يلاقي	3	to find, encounter, meet, to consider (something to be something)
1409	لاهَت	يلاهَت	لاهت	يلاهت	3	to be out of breath, to pant
1410	مارَس	يمارَس	مارس	يمارس	3	to practise (a profession), to apply, exert, use
1411	ماطَل	يماطَل	ماطل	يماطل	3	to put off, temporize, give someone the runaround
1412	نادى	ينادي	نادى	ينادي	3	to call out, announce, call, send for
1413	نازَع	ينازَع	نازع	ينازع	3	to be dying, be in the throes of death, to struggle
1414	ناسَب	يناسَب	ناسب	يناسب	3	to suit, be suitable, to be related by marriage
1415	نافَس	ينافَس	نافس	ينافس	3	to compete with
1416	ناقَش	يناقَش	ناقش	يناقش	3	to discuss, exchange ideas
1417	ناقَض	يناقَض	ناقض	يناقض	3	to contradict
1418	ناوَل	يناوَل	ناول	يناول	3	to give, hand (over), pass, deliver
1419	هاجَر	يهاجَر	هاجر	يهاجر	3	to emigrate
1420	هاجَم	يهاجَم	هاجم	يهاجم	3	to attack
1421	واجَه	يواجَه	واجه	يواجه	3	to come face to face with, confront, face up to, to encounter, come across, run into
1422	وازَن	يوازَن	وازن	يوازن	3	to equal in weight, be balanced, to strike a balance, equalize
1423	واظَب	يزاظَب	واظب	يزاظب	3	to persevere, keep up, persist
1424	وافَق	يوافَق	وافق	يوافق	3	to agree with
1425	أَباد	يُبيد	اباد	يبيد	4	to exterminate
1426	أَبرَز	يِبرَز	ابرز	يبرز	4	to make prominent, accentuate, emphasize, highlight
1427	أَبرَق	يِبرَق	ابرق	يبرق	4	to flash with lightning
1428	أَبسَط	يِبسَط	ابسط	يبسط	4	to please, delight, gladden, make happy
1429	أَبطَل	يِبطَل	ابطل	يبطل	4	to cancel, neutralize, dismantle, disarm
1430	أَبعَد	يِبعَد	ابعد	يبعد	4	to move something away, to banish/deport/expel
1431	أَتعَب	يِتعَب	اتعب	يتعب	4	to tire, wear out
1432	أَتقَن	يتقن	اتقن	يتقن	4	to be proficient, know well, master
1433	أَتلَج	يتلَج	اتلج	يتلج	4	to snow
1434	أَثار	يثير	اثار	يثير	4	to arouse, awaken, raise
1435	أَثبَت	يِثبَت	اثبت	يثبت	4	to prove, establish
1436	أَجرى	يِجري	اجرى	يجري	4	to hold, conduct, carry out
1437	أَجَلّ	يجل	اجل	يجل	4	to honor, esteem
1438	أَجلى	يِجلي	اجلى	يجلي	4	to remove, evacuate (people)
1439	أَحرَج	يحرج	احرج	يحرج	4	to embarrass
1440	أَحرَز	يِحرَز	احرز	يحرز	4	to be worthwhile
1441	أَحصى	يَحصي	احصى	يحصي	4	to count, enumerate
1442	أَخرَج	يِخرَج	اخرج	يخرج	4	to take out, bring out, produce, direct
1443	أخطى	يِخطي	اخطى	يخطي	4	to be mistaken, to miss (target)
1444	أَخفى	يِخفي	اخفى	يخفي	4	to hide, conceal
1445	أَخلى	يِخلي	اخلى	يخلي	4	to empty, to evacuate (place, area)
1446	أَدَار	يدير	ادار	يدير	4	to manage, administer
1447	أَدهَش	يِدهَش	ادهش	يدهش	4	to surprise, astonish, astound
1448	أَدّى	يأَدّي	ادى	يادي	4	to carry out, perform, lead to, bring about, cause
1449	أَراد	يريد	اراد	يريد	4	to want
1450	أَرجَع	يِرجَع	ارجع	يرجع	4	to give back, put back, return
1451	أَرشَد	يِرشَد	ارشد	يرشد	4	to guide, instruct, direct
1452	أَرضى	يِرضي	ارضى	يرضي	4	to satisfy, please
1453	أَركَن	يِركَن	اركن	يركن	4	to rely on, trust
1454	أَزعَج	يِزعَج	ازعج	يزعج	4	to annoy, disturb, bother
1455	أَزعَل	يِزعَل	ازعل	يزعل	4	to upset, annoy
1456	أَزى	يِئزي	ازى	ييزي	4	to harm, hurt, damage
1457	أَسرَع	يِسرَع	اسرع	يسرع	4	to hurry, be in a hurry, to drive quickly, speed
1458	أَسقَط	يُسقَط	اسقط	يسقط	4	to cause to fall, bring down, shoot down
1459	أَسكَر	يِسكَر	اسكر	يسكر	4	to intoxicate, make drunk
1460	أَسلَم	يُسلَم/يأَسلَم	اسلم	يسلم/ياسلم	4	to convert to Islam
1461	أَشبَع	يِشبَع	اشبع	يشبع	4	to satisfy, gratify (appetite)
1462	أَشتى	يشتي	اشتى	يشتي	4	to rain
1463	أَشرَك	يِشرَك	اشرك	يشرك	4	to include
1464	أَشعَل	يِشعَل	اشعل	يشعل	4	to set on fire
1465	أَصبَح	يِصبَح	اصبح	يصبح	4	to be in the morning, to become, turn into
1466	أَصدَر	يِصدَر	اصدر	يصدر	4	to bring out, issue, publish
1467	أَصَرّ	يصَرّ	اصر	يصر	4	to insist, persist, stick to, be determined, be set on
1468	أَصلَح	يِصلَح	اصلح	يصلح	4	to make peace, bring about reconciliation
1469	أَضاف	يضيف	اضاف	يضيف	4	to add
1470	أَضرَب	يِضرَب	اضرب	يضرب	4	to strike, go on strike
1471	أَضعَف	يِضعَف	اضعف	يضعف	4	to weaken, undermine
1472	أَطاع	يطيع	اطاع	يطيع	4	to obey
1473	أَطلَع	يَطلَع	اطلع	يطلع	4	to take up, bring up, take out, bring out
1474	أَطلَق	يِطلَق	اطلق	يطلق	4	to release, set free, send, send away, discharge, set off, let off
1475	أَظهَر	يَظهَر	اظهر	يظهر	4	to appear, to reveal/show
1476	أَعاد	يُعيد	اعاد	يعيد	4	to return something, give something back
1477	أَعجَب	يعجب	اعجب	يعجب	4	to please, satisfy
1478	أَعدَم	يِعدَم	اعدم	يعدم	4	to destroy, execute, put to death
1479	أَعدى	يِعدي	اعدى	يعدي	4	to be infectious/contagious, to infect
1480	أَعرَب	يَعرَب	اعرب	يعرب	4	to parse, to express
1481	أَعطى	يَعطي	اعطى	يعطي	4	to give
1482	أَعفى	يِعفي	اعفى	يعفي	4	to exempt
1483	أَعلَن	يِعلَن	اعلن	يعلن	4	to announce, declare
1484	أَعم	يِعمي	اعم	يعمي	4	to blind, to dazzle
1485	أَغرى	يِغري	اغرى	يغري	4	to tempt, induce, seduce
1486	أَفاد	يفيد	افاد	يفيد	4	to benefit, be useful/beneficial/effective/advantageous, to interest
1487	أَفرَج	يِفرَج	افرج	يفرج	4	to release (from prison, custody, etc)
1488	أَفشَل	يِفشَل	افشل	يفشل	4	to foil, frustrate, thwart
1489	أَفطَر	يِفطَر	افطر	يفطر	4	to have breakfast, to break a fast
1490	أفلَس	يِفلَس	افلس	يفلس	4	to go bankrupt
1491	أَقنَع	يِقنَع	اقنع	يقنع	4	to convince
1492	أَكرَم	يِكرَم	اكرم	يكرم	4	to honor, respect, to host, treat hospitably
1493	أَلَحّ	يلَحّ	الح	يلح	4	to pressure, urge, implore
1494	أَلغى	يِلغي	الغى	يلغي	4	to cancel, invalidae, abolish
1495	أَلقى	يُلقي	القى	يلقي	4	to throw, drop, give, deliver (lecture/talk/speech)
1496	أَلهى	يِلهي	الهى	يلهي	4	to distract
1497	أَمَر	يؤمُر	امر	يومر	4	to order, command
1498	أَملى	يِملي	املى	يملي	4	to dictate
1499	أَمهَل	يِمهَل	امهل	يمهل	4	to give someone time, grant respite
1500	أَنجَز	يِنجَز	انجز	ينجز	4	to achieve, accomplish, realize, put into practice, finish off
1501	أَنطى	يَنطي	انطى	ينطي	4	to give (Galilee)
1502	أَنعَم	يِنعَم	انعم	ينعم	4	to confer, bestow, favor, make something pleasant
1503	أَنقَذ	يِنقّذ	انقذ	ينقذ	4	to save, rescue
1504	أَنكَر	يِنكَر	انكر	ينكر	4	to deny
1505	أَنهى	يِنهي	انهى	ينهي	4	to end, finish, put an end to
1506	أَهان	يهين	اهان	يهين	4	to insult, offend
1507	أَهدى	يِهدي	اهدى	يهدي	4	to dedicate, send, convey
1508	أَهمَل	يِهمَل	اهمل	يهمل	4	to neglect
1509	تعاطى	يِتعَطى	تعاطى	يتعطى	4	to take (medicine, drug)
1510	تأَثَّر	يِتأَثَّر	تاثر	يتاثر	5	to be influenced, be effected, be impressed, be touched
1511	تأَخَّر	يِأَخَّر	تاخر	ياخر	5	to be late
1512	تأَزَّم	يِتأَزَّك	تازم	يتازك	5	to become critical, come to a head, reach a crisis
1513	تأَسَّف	يِتأَسَّف	تاسف	يتاسف	5	to be sorry
1514	تأَكَّد	يِتأَكَّد	تاكد	يتاكد	5	to be confirmed, turn out to be true / right, to be sure, be convinced, make sure
1515	تأَلَّم	يِتأَلَّم	تالم	يتالم	5	to suffer, be in pain
1516	تأَمَّر	يِتأَمَّر	تامر	يتامر	5	to lord over, order about, behave imperiously
1517	تأَمَّل	يِتأَمَّل	تامل	يتامل	5	to hope, to contemplate, meditate, consider, reflect upon
1518	تبَخَّر	يِتبَخَّر	تبخر	يتبخر	5	to evaporate
1519	تبَدَّل	يِتبَدَّل	تبدل	يتبدل	5	to be replaced
1520	تبَرَّع	يِتبَرَّع	تبرع	يتبرع	5	to donate, contribute, to volunteer
1521	تبَرّى	يِتبَرّى	تبرى	يتبرى	5	to be acquitted, be declared innocent, to refuse to accept responsibility, wash one's hands of
1522	تبَضَّع	يِتبَضَّع	تبضع	يتبضع	5	to go shopping, buy goods
1523	تبَطَّح	يِتبَطَّح	تبطح	يتبطح	5	to lie down flat, lie on one's stomach
1524	تبَنّى	يِتبَنّى	تبنى	يتبنى	5	to adopt
1525	تبَيَّن	يِتبَيَّن	تبين	يتبين	5	to emerge, become clear, become obvious
1526	تجَبَّد	يِتجَبَّد	تجبد	يتجبد	5	to stretch, stretch oneself
1527	تجَدَّد	يِتجَدَّد	تجدد	يتجدد	5	to be renewed
1528	تجَسَّس	يِتجَسَّس	تجسس	يتجسس	5	to spy
1529	تجَمَّع	يِتجَمَّع	تجمع	يتجمع	5	to congregate, gather together, assemble
1530	تجَنَّب	يِتجَنَّب	تجنب	يتجنب	5	to avoid, keep away from
1531	تجَنَّد	يِتجَنَّد	تجند	يتجند	5	to enlist, be conscripted, be drafted
1532	تجَوَّز	يِتجَوَّز	تجوز	يتجوز	5	to get married, to marry
1533	تجَوَّل	يِتجَوَّل	تجول	يتجول	5	to tour walk/travel around, roam, wander
1534	تحَدَّث	يِتحَدَّث	تحدث	يتحدث	5	to talk, chat, carry on a conversation
1535	تحَدّى	يِتحَدّى	تحدى	يتحدى	5	to provoke, to challenge
1536	تحَرَّر	يِتحَرَّر	تحرر	يتحرر	5	to free oneself, mecome free
1537	تحَرَّك	يِتحَرَّك	تحرك	يتحرك	5	to move (intrans)
1538	تحَسَّر	يِتحَسَّر	تحسر	يتحسر	5	to feel nostalgia, to sigh for, sigh over, lament
1539	تحَسَّس	يِتحَسَّس	تحسس	يتحسس	5	to grope (yo way in the dark)
1540	تحَسَّن	يِتحَسَّن	تحسن	يتحسن	5	to improve (intrans)
1541	تحَطَّم	يِتحَطَّم	تحطم	يتحطم	5	to get smashed up, break up, fall apart
1542	تحَفَّظ	يِتحَفَّظ	تحفظ	يتحفظ	5	to be wary, be cautious, to have reservations
1543	تحَقَّق	يِتحَقَّق	تحقق	يتحقق	5	to come true, be shown to be true, be proved true, to verify, confirm, make sure, check
1544	تحَكَّم	يِتحَكَّم	تحكم	يتحكم	5	to be treated, to control
1545	تحَمَّر	يِتحَمَّر	تحمر	يتحمر	5	to become red, to be well-done (meat), to put on lipstick
1546	تحَمَّس	يِتحَمَّس	تحمس	يتحمس	5	to get enthusiastic, become excited
1547	تحَمَّل	يِتحَمَّل	تحمل	يتحمل	5	to bear, stand
1548	تحَمَّم	يِتحَمَّم	تحمم	يتحمم	5	to bathe (intrans)
1549	تحَنّى	يِتحَنّى	تحنى	يتحنى	5	to henna one's hair, to decorate oneself with henna
1550	تحَوَّل	يِتحَوَّل	تحول	يتحول	5	to become, turn into, be transferred
1551	تحَيَّر	يِتحَيَّر	تحير	يتحير	5	to be/become embarrassed, to be at a loss, have no idea
1552	تحَيَّز	يِتحَيَّز	تحيز	يتحيز	5	to side with, favor, take sides
1553	تخَبّى	يِتخَبّى	تخبى	يتخبى	5	to hide (intrans), hide oneself
1554	تخَرَّج	يِتخَرَّج	تخرج	يتخرج	5	to graduate
1555	تخَرَّف	يِتخَرَّف	تخرف	يتخرف	5	to talk to each other, chat, tell each other stories
1556	تخَصَّص	يِتخَصَّص	تخصص	يتخصص	5	to specialize
1557	تخَلَّص	يِتخَلَّص	تخلص	يتخلص	5	to get rid of, rid oneself, free oneself
1558	تخَوَّت	يِتخَوَّف	تخوت	يتخوف	5	to be fearful, be apprehensive, be scared, be afraid
1559	تخَوَّت	يِتخَوَّت	تخوت	يتخوت	5	to fool around, horse around, joke around
1560	تخَيَّل	يِتخَيَّل	تخيل	يتخيل	5	to imagine, fancy
1561	تدَبَّر	يِتدَبَّر	تدبر	يتدبر	5	to sort itself out, be taken care of
1562	تدَخَّل	يِتدَخَّل	تدخل	يتدخل	5	to interfere, meddle
1563	تدَرَّع	يِتدَرَّع	تدرع	يتدرع	5	to burp (intrans)
1564	تدَشّى	يِتدَشّى	تدشى	يتدشى	5	to belch
1565	تدَفّى	يِتدَفّى	تدفى	يتدفى	5	to warm up (intrans), get warm, warm oneself
1566	تدَلَّع	يِتدَلَّع	تدلع	يتدلع	5	to become spoilt, to behave like a spoilt child, to be demanding
1567	تدَلَّل	يِتدَلَّل	تدلل	يتدلل	5	to demand attention, indulge oneself
1568	تدَوَّش	يِتدَوَّش	تدوش	يتدوش	5	to shower, take a shower
1569	تدَيَّن	يِتدَيَّن	تدين	يتدين	5	to be religious, be observant
1570	تذَمَّر	يِتذَمَّر	تذمر	يتذمر	5	to complain
1571	ترَئَّس	يِترَئَّس	تريس	يتريس	5	to head, be in charge, to chair
1572	ترَبَّع	يِترَبَّع	تربع	يتربع	5	to sit cross-legged
1573	ترَبّى	يِترَبّى	تربى	يتربى	5	to grow up, be brought up, be educated, be raised
1574	ترَجّى	يِترَجّى	ترجى	يترجى	5	to look forward to, hopefor, ask for, to beg, plead, implore
1575	ترَدَّد	يِترَدَّد	تردد	يتردد	5	to hesitate, to visit often, pay repeated visits
1576	ترَسَّب	يِترَسَّب	ترسب	يترسب	5	to settle, accumulate, build up (all intrans)
1577	ترَصَّد	يِترَصَّد	ترصد	يترصد	5	to lie in wait, set an ambush
1578	ترَقّى	يِترَقّى	ترقى	يترقى	5	to be promoted, recieve a promotion, climb the social ladder
1579	ترَمَّل	يِترَمَّل	ترمل	يترمل	5	to be widowed
1580	ترَنَّح	يِترَنَّح	ترنح	يترنح	5	to stagger
1581	ترَيَّح	يِترَيَّح	تريح	يتريح	5	to relax, rest, to feel relieved, be relieved (of worry, problems)
1582	تزَكَّر	يِتزَكَّر	تزكر	يتزكر	5	to remember, recall
1583	تزَلَّج	يِتزَلَّج	تزلج	يتزلج	5	to slide along, to skate, to ski
1584	تزَوَّج	يِتزَوَّج	تزوج	يتزوج	5	to get married, marry (intrans)
1585	تسَبَّب	يِتسَبَّب	تسبب	يتسبب	5	to be caused, to result, to earn a small amount of money, make a few bucks
1586	تسَخَّن	يِتسَخَّن	تسخن	يتسخن	5	to heat up (intrans), be heated
1587	تسَدَّق	يِتسَدَّق	تسدق	يتسدق	5	to be credible, be believable
1588	تسَرَّب	يِتسَرَّب	تسرب	يتسرب	5	to run out, flow off, to sneak out
1589	تسَرَّح	يِتسَرَّح	تسرح	يتسرح	5	to get demobilized
1590	تسَرَّع	يِتسَرَّع	تسرع	يتسرع	5	to hurry, be in a hurry, go too fast, be too hasty
1591	تسَطَّح	يِتسَطَّح	تسطح	يتسطح	5	to lie down
1592	تسَكَّر	يِتسَكَّر	تسكر	يتسكر	5	to close (intrans)
1593	تسَلَّط	يِتسَلَّط	تسلط	يتسلط	5	to take control of, take over, sieze control of, dominate
1594	تسَلّى	يِتسَلّى	تسلى	يتسلى	5	to pass the time, have fun, have a good time, amuse/entertain/enjoy oneself
1595	تسَمَّم	يِتسَمَّم	تسمم	يتسمم	5	to get poisoned, get food poisoning
1596	تسَهَّل	يِتسَهَّل	تسهل	يتسهل	5	to depart, leave, go
1597	تسَهَّل	يِتسَهَّل	تسهل	يتسهل	5	to become easy, to set out, go
1598	تسَوَّق	يِتسَوَّق	تسوق	يتسوق	5	to shop, go shopping
1599	تشَبَّع	يِتشَبَّع	تشبع	يتشبع	5	to become saturated, become full to capacity
