Num	past_a	pres_a	past_b	pres_b	form	def
1600	تشَتَّت	يِتشَتَّت	تشتت	يتشتت	5	to disperse, scatter (intrans)
1601	تشَجَّع	يِتشَجَّع	تشجع	يتشجع	5	to be encouraged, take heart
1602	تشَرَّف	يِتشَرَّف	تشرف	يتشرف	5	to be honored
1603	تشَعَّب	يِتشَعَّب	تشعب	يتشعب	5	to branch, form, to branch out, branch off
1604	تشَكّى	يِتشَكّى	تشكى	يتشكى	5	to complain
1605	تشَنَّج	يِتشَنَّج	تشنج	يتشنج	5	to be in spasm, have a cramp
1606	تصَرَّف	يِتصَرَّف	تصرف	يتصرف	5	to behave, to behave well, to cope, manage
1607	تصَفَّح	يِتصَفَّح	تصفح	يتصفح	5	to leaf through, flick through (book etc)
1608	تصَلَّب	يِتصَلَّب	تصلب	يتصلب	5	to harden, become hard
1609	تصَوَّر	يِتصَوَّر	تصور	يتصور	5	to imagine, to get photographed
1610	تصَيَّد	يِتصَيَّد	تصيد	يتصيد	5	to hunt, to fish
1611	تضَخَّم	يِتضَخَّم	تضخم	يتضخم	5	to expand, dilate, inflate, swell up
1612	تضَرَّر	يِتضَرَّر	تضرر	يتضرر	5	to sustain damage, get damaged
1613	تطَبَّش	يِتطَبَّش	تطبش	يتطبش	5	to crash into each other, collide
1614	تطَرَّف	يِتطَرَّف	تطرف	يتطرف	5	to become an extremist, be extreme, go to extremes, hold radical views
1615	تطَلَّع	يِتطَلَّع	تطلع	يتطلع	5	to look, look at
1616	تطَمَّن	يِتطَمَّن	تطمن	يتطمن	5	to calm down, have one's fears allayed, be reassured, reassure oneself, have one's mind put at rest
1617	تطَوَّر	يِتطَوَّر	تطور	يتطور	5	to develop (intrans)
1618	تطَوَّع	يِتطَوَّع	تطوع	يتطوع	5	to volunteer
1619	تعَجَّب	يِتعَجَّب	تعجب	يتعجب	5	to be surprised, be astonished, be amazed, marvel at, wonder
1620	تعَدَّد	يِتعَدَّد	تعدد	يتعدد	5	to multiply, proliferate, become numerous
1621	تعَرَّض	يِتعَرَّض	تعرض	يتعرض	5	to risk, be exposed to, to pester, harass
1622	تعَرَّف	يِتعَرَّف	تعرف	يتعرف	5	to get to know, make acquaintance of, to introduce oneself
1623	تعَزَّز	يتعزز	تعزز	يتعزز	5	to be strengthened, become stronger
1624	تعَشّى	يِتعَشّى	تعشى	يتعشى	5	to dine, to sup, to have dinner
1625	تعَصَّب	يِتعَصَّب	تعصب	يتعصب	5	to become extremist, become a fanatic
1626	تعَطَّر	يِتعَطَّر	تعطر	يتعطر	5	to put on perfume, weat a scent
1627	تعَطَّش	يِتعَطَّش	تعطش	يتعطش	5	to thirst for, long for
1628	تعَطَّل	يِتعَطَّل	تعطل	يتعطل	5	to become unemployed, be out of work, to stop working, to stall (engine)
1629	تعَكَّز	يِتعَكَّز	تعكز	يتعكز	5	to lean, support oneself
1630	تعَلَّق	يِتعَلَّق	تعلق	يتعلق	5	to cling, hold on to, clutch at, to depend, to become emotionally attached
1631	تعَلَّم	يِتعَلَّم	تعلم	يتعلم	5	to learn
1632	تعَمَّد	يِتعّمَّد	تعمد	يتعمد	5	to be baptized
1633	تعَمَّق	يِتعَمَّق	تعمق	يتعمق	5	to go into (somthing) deeply
1634	تعَهَّد	يِتعَهَّد	تعهد	يتعهد	5	to commit oneself, pledge, undertake, promise
1635	تعَوَّد	يِتعَوَّد	تعود	يتعود	5	to get used to, become accustomed to
1636	تعَوَّق	يِتعَوَّق	تعوق	يتعوق	5	to be delayed, be detained, get held up
1637	تعَيَّن	يِتعَيَّن	تعين	يتعين	5	to be appointed, get nominated
1638	تغَدّى	يِتغَدّى	تغدى	يتغدى	5	to have lunch
1639	تغَرَّق	يِتغَرَّق	تغرق	يتغرق	5	to get soaking wet
1640	تغَسَّل	يِتغَسَّل	تغسل	يتغسل	5	to wash oneself, to bathe, take a bathshower
1641	تغَشَّم	يِتغَشَّم	تغشم	يتغشم	5	to fail to recognize
1642	تغَلَّب	يِتغَلَّب	تغلب	يتغلب	5	to find difficult, have a hard time, to overcome
1643	تغَيَّر	يِتغَيَّر	تغير	يتغير	5	to change (intrans)
1644	تفَرَّج	يِتفَرَّج	تفرج	يتفرج	5	to watch, look at, observe (nature, TV, pictures, etc)
1645	تفَرَّغ	يِتفَرَّغ	تفرغ	يتفرغ	5	to free oneself, make time for, to be emptied out
1646	تفَرَّق	يِتفَرَّق	تفرق	يتفرق	5	to scatter, disperse, split up
1647	تفَضَّل	يِتفَضَّل	تفضل	يتفضل	5	to be so kind (as to)
1648	تفَوَّق	يِتفَوَّق	تفوق	يتفوق	5	to excell
1649	تقَدَّم	يِتقَدَّم	تقدم	يتقدم	5	to move forward, advance, progress
1650	تقَشَّف	يِتقَشَّف	تقشف	يتقشف	5	to be an ascetic, lead an ascetic life
1651	تقَلَّب	يِتقَلَّب	تقلب	يتقلب	5	to turn over repeatedly (intrans), to fluctuate, be changeable, be unpredictable
1652	تقَلَّص	يِتقَلَّص	تقلص	يتقلص	5	to shrink, contract, get smaller
1653	تكَبَّر	يِتكَبَّر	تكبر	يتكبر	5	to get bigger, to boast
1654	تكَتَّف	يِتكَتَّف	تكتف	يتكتف	5	to fold one's arms
1655	تكَرَّر	يِتكَرَّر	تكرر	يتكرر	5	to recur, happen again, be repeated
1656	تكَلَّم	يِتكَلَّم	تكلم	يتكلم	5	to speak (more formal)
1657	تكَوَّر	يِتكَوَّر	تكور	يتكور	5	to become round, become spherical, to curl up
1658	تكَوَّن	يِتكَوَّن	تكون	يتكون	5	to pile up, accumulate
1659	تكَيَّف	يِتكَيَّف	تكيف	يتكيف	5	to adjust, adapt oneself
1660	تلَبَّك	يِتلَبَّك	تلبك	يتلبك	5	to become disorganized, get confused, be at a loss, not know what to do/think
1661	تلَخَّص	يِتلَخَّص	تلخص	يتلخص	5	to be summed up
1662	تلَفَّت	يِتلَفَّت	تلفت	يتلفت	5	to turn around, swing round, look round
1663	تلَقَّح	يِتلَقَّح	تلقح	يتلقح	5	to lie down
1664	تمَتَّع	يِتمَتَّع	تمتع	يتمتع	5	to enjoy
1665	تمَدَّد	يِتمَدَّد	تمدد	يتمدد	5	to lie down (extend oneself),
1666	تمَرَّد	يِتمَرَّد	تمرد	يتمرد	5	to rebel, revolt
1667	تمَرَّن	يِتمَرَّن	تمرن	يتمرن	5	to practise, excersize, train oneself
1668	تمَسَّك	يِتمَسَّك	تمسك	يتمسك	5	to hold, cling, stick to
1669	تمَشَّط	يِتمَشَّط	تمشط	يتمشط	5	to comb one's hair
1670	تمَكَّن	يِتمَكَّن	تمكن	يتمكن	5	to be able, be capable
1671	تمَلَّق	يِتمَلَّق	تملق	يتملق	5	to flatter, to suck up to, brown nose
1672	تمَلَّك	يِتمَلَّك	تملك	يتملك	5	to take possession of, sieze, usurp, appropriate
1673	تمَنّى	يِتمَنّى	تمنى	يتمنى	5	to wish, hope
1674	تمَوَّن	يِتمَوَّن	تمون	يتمون	5	to stock up with provisions/supplies
1675	تمَيَّز	يِتمَيَّز	تميز	يتميز	5	to distinguish oneself, stand out, be special, be different
1676	تنَبَّئ	يِنَبَّ	تنبي	ينب	5	to prophesy, fortell
1677	تنَجَّس	يِتنَجَّس	تنجس	يتنجس	5	to become ritually impure (eg by touching a dog)
1678	تنَشَّف	يِتنَشَّف	تنشف	يتنشف	5	to dry
1679	تنَفَّذ	يِتنَفَّذ	تنفذ	يتنفذ	5	to be implemented, be executed, be carried out, be kept
1680	تنَفَّس	يِتنَفَّس	تنفس	يتنفس	5	to breathe
1681	تنَكَّر	يِتنَكَّر	تنكر	يتنكر	5	to be estranged, be alienated, to dress up, disguise yourself
1682	تهَرَّب	يِتهَرَّب	تهرب	يتهرب	5	to run away, escape, avoid, evade, shirk
1683	تهَزَّر	يِتهَوَّر	تهزر	يتهور	5	to endanger oneself, take risks, behave recklessly
1684	تهَوّى	يِتهَوّى	تهوى	يتهوى	5	to get aired out
1685	تهَيَّج	يِتهَيَّج	تهيج	يتهيج	5	to be in a ferment, be agitated, to be stormy, be rough
1686	توَتَّر	يِتوَتَّر	توتر	يتوتر	5	to tense up, become tense
1687	توَجَّع	يِتوَجَّع	توجع	يتوجع	5	to suffer pain, be in pain
1688	توَجَّه	يِتوَجَّه	توجه	يتوجه	5	to turn towards, to apply to, address, speak to
1689	توَحَّل	يِتوَحَّل	توحل	يتوحل	5	to get muddy, get covered in mud
1690	توَرَّت	يِتوَرَّت	تورت	يتورت	5	to inherit, be inherited
1691	توَرَّم	يِتوَرَّم	تورم	يتورم	5	to swell (intrans), swell up
1692	توَزَّع	يِتوَزَّع	توزع	يتوزع	5	to be divided, be distributed
1693	توَسَّخ	يِتوَسَّخ	توسخ	يتوسخ	5	to get dirty, become soiled
1694	توَسَّع	يِتوَسَّع	توسع	يتوسع	5	to expand, extend, spread, spread out (intrans)
1695	توَصَّل	يِتوَصَّل	توصل	يتوصل	5	to arrive at, reach, attain, to achieve
1696	توَضَّح	يِتوَضَّح	توضح	يتوضح	5	to become clearer, be clarified, get cleared up
1697	توَضّى	يِتوَضّى	توضى	يتوضى	5	to wash (intrans), perform ritual ablution for prayer
1698	توَفَّر	يِتوَفَّر	توفر	يتوفر	5	to abound, be numerous, be abundant
1699	توَفّى	يِتوَفّى	توفى	يتوفى	5	to die, pass away
1700	توَقَّع	يِتوَقَّع	توقع	يتوقع	5	to expect
1701	توَقَّف	يِتوَقَّف	توقف	يتوقف	5	to stop, halt, cease (intrans), be arrested, to depend
1702	توَكَّل	يِتوَكَّل	توكل	يتوكل	5	to have confidence in, trust on, have faith in
1703	توَلَّد	يِتوَلَّد	تولد	يتولد	5	to be born, originate, be created, develop
1704	تيَتَّم	يِتيَتَّم	تيتم	يتيتم	5	to be orphaned
1705	تآنَس	يِتآنَس	تانس	يتانس	6	to get together, spend time together (provide each other with company)
1706	تباخَل	يِتلباخَل	تباخل	يتلباخل	6	to be stingy
1707	تبادَل	يِتبادَل	تبادل	يتبادل	6	to exchange, substitute, change, be mutual
1708	تباوَس	يِتباوَس	تباوس	يتباوس	6	to kiss each other, exchange kisses
1709	تتاكَل	يِتّاكَل	تتاكل	يتاكل	6	to be eaten, be edible
1710	تتاوَب	يِتتاوَب	تتاوب	يتتاوب	6	to yawn
1711	تجادَل	يِتجادَل	تجادل	يتجادل	6	to argue with each other
1712	تجاهَل	يِتجاهَل	تجاهل	يتجاهل	6	to ignore, disregard, refuse to acknowledge, give the cold shoulder
1713	تجاوَز	يِتجاوَز	تجاوز	يتجاوز	6	to go beyond, overstep, overtake
1714	تحابَب	يِتحابَب	تحابب	يتحابب	6	to love each other
1715	تحانَق	يِتحانَق	تحانق	يتحانق	6	to quarrel, have a fight, strangle each other
1716	تخاصَم	يِتخاصَم	تخاصم	يتخاصم	6	to be in conflict with each other, be rivals
1717	تدارى	يِتدارى	تدارى	يتدارى	6	to protect oneself, take selter
1718	تدافَش	يِتدافَش	تدافش	يتدافش	6	to push one another, jostle one another
1719	تدايَق	يِتدايَق	تدايق	يتدايق	6	to be disturbed, be bothered, be troubled, get irritated, get upset, get annoyed
1720	تدايَن	يِتدايَن	تداين	يتداين	6	to borrow (money), get into debt
1721	تراجَع	يِتراجَع	تراجع	يتراجع	6	to retreat, withdraw, to drop, change one's mind about, revoke, go back on
1722	تراخى	يِتراخى	تراخى	يتراخى	6	to get sloppy, become lax
1723	تراقَب	يِتراقَب	تراقب	يتراقب	6	to be under supervision, be censored
1724	تراهَن	يِتراهَن	تراهن	يتراهن	6	to bet, wager
1725	تزاعَل	يِتزعَل	تزاعل	يتزعل	6	to be angry with each other
1726	تسابَق	يِتسابَق	تسابق	يتسابق	6	to compete, have a race
1727	تساعَد	يِتساعَد	تساعد	يتساعد	6	to help one another
1728	تساهَل	يِتساهَل	تساهل	يتساهل	6	to be lenient, be flexible, be forebearing
1729	تشائَم	يِتشائَم	تشايم	يتشايم	6	to be pessimistic, expect the worst, to be superstitious, believe something brings bad luck
1730	تشابَه	يِتشابَه	تشابه	يتشابه	6	to be alike, resemble each other
1731	تشارَط	يِتشارَط	تشارط	يتشارط	6	to impose conditions on each other, to bet each other
1732	تشاطَر	يِتشاطَر	تشاطر	يتشاطر	6	to be a wise guy, be a know it all
1733	تشاوَر	يِتشاوَر	تشاور	يتشاور	6	to consult, deliberate
1734	تصادَف	يِتصادَف	تصادف	يتصادف	6	to meet by chance, run into each other, come across each other
1735	تصادَم	يِتصادَم	تصادم	يتصادم	6	to crash (intrans), crash into each other, collide
1736	تصالَح	يِتصالَح	تصالح	يتصالح	6	to make peace with one another, reconcile, make up
1737	تصاوَب	يِتصاوَب	تصاوب	يتصاوب	6	to get wounded
1738	تصايَح	يِتصايَح	تصايح	يتصايح	6	to shout/yell at one another
1739	تضارَب	يِتضارَب	تضارب	يتضارب	6	to hit / strike / slap one another, to run / crash into one another
1740	تضامَن	يِتضامَن	تضامن	يتضامن	6	to show solidarity
1741	تظاهَر	يِتظاهَر	تظاهر	يتظاهر	6	to demonstrate, protest, to feign, pretend
1742	تعابَط	يِتعابَط	تعابط	يتعابط	6	to behave stupidly, act like an idiot, to hug each other
1743	تعادَل	يِتعادَل	تعادل	يتعادل	6	to be equal [to], to draw (sports/games)
1744	تعاقَب	يِتعاقَب	تعاقب	يتعاقب	6	to be punished (by the legal system)
1745	تعالَج	يِتعالَج	تعالج	يتعالج	6	to be treated, recieve treatment
1746	تعامَل	يِتعامَل	تعامل	يتعامل	6	to work with, to treat, deal with, relate to
1747	تعاوَن	يِتعاوَن	تعاون	يتعاون	6	to cooperate, help one another
1748	تعايَش	يِتعايَش	تعايش	يتعايش	6	to coexist
1749	تغازَل	يِتغازَل	تغازل	يتغازل	6	to flirt with each other
1750	تغاشَم	يِتغاشَم	تغاشم	يتغاشم	6	to pretend to be inexperienced/ignorant
1751	تغامَز	يِتغامَ	تغامز	يتغام	6	to exchange (knowing) winks, wink at one another
1752	تفاجَئ	يِتفاجَئ	تفاجي	يتفاجي	6	to be surprised, be taken by surprise
1753	تفارَق	يِتفارَق	تفارق	يتفارق	6	to part, split up
1754	تفاهَم	يِتفاهَم	تفاهم	يتفاهم	6	to understand one another, to reach an understanding
1755	تفاوَض	يِتفاوَض	تفاوض	يتفاوض	6	to negotiate
1756	تقابَل	يِتقابَل	تقابل	يتقابل	6	to meet (intrans), meet with, to be recieved by
1757	تقاتَل	يِتقاتَل	تقاتل	يتقاتل	6	to hit one another, to fight
1758	تقارَب	يِتقارَب	تقارب	يتقارب	6	to become close, draw closer to one another
1759	تقاسَم	يِتقاسَم	تقاسم	يتقاسم	6	to share, divide up
1760	تقاصَص	يِتقاصَص	تقاصص	يتقاصص	6	to be punished (home/scool)
1761	تقاعَد	يِتقاعَد	تقاعد	يتقاعد	6	to retire (from work)
1762	تكاتَب	يِتكاتَب	تكاتب	يتكاتب	6	to correspond, write to each other
1763	تكاسَل	يِتكاسَل	تكاسل	يتكاسل	6	to be lazy, be idle, be too lazy to (do something)
1764	تلاعَب	يِتلاعَب	تلاعب	يتلاعب	6	to cheat, get up to funny business (esp. prices)
1765	تمالَك	يِتمالَك	تمالك	يتمالك	6	to restrain oneself, hold oneself back
1766	تمايَع	يِتمايَع	تمايع	يتمايع	6	to liquify, melt, behave flirtatiously, become flabby
1767	تنازَل	يِتنازَل	تنازل	يتنازل	6	to give up, concede, drop
1768	تناسَب	يِتناسَب	تناسب	يتناسب	6	to be(come) related by marriage
1769	تناطَح	يِتناطَح	تناطح	يتناطح	6	to butt each other
1770	تناقَض	يِتناقَض	تناقض	يتناقض	6	to contradict one another, be contradictory
1771	تناوَب	يِتناوَب	تناوب	يتناوب	6	to take turns, spell each other, work in shifts
1772	تناوَل	يِتناوَل	تناول	يتناول	6	to go to communion (christianity)
1773	تهابَل	يِتهابَل	تهابل	يتهابل	6	to pretend to be stupid, to act stupidly
1774	تهاوَن	يِتهاوَن	تهاون	يتهاون	6	to treat lightly, attach little importance to
1775	توافَق	يِتوافَق	توافق	يتوافق	6	to fit in, tally, make sense with
1776	إنأَسَر	يِنأَسَر	اناسر	يناسر	7	to be taken prisoner
1777	إنباع	يِنباع	انباع	ينباع	7	to be sold
1778	إنبَحّ	يِنبَحّ	انبح	ينبح	7	to become hoarse, lose your voice
1779	إنبَسَط	يِنبَسَط	انبسط	ينبسط	7	to be pleased, be happy, be glad, to enjoy yourself
1780	إنبَلّ	يِنبَلّ	انبل	ينبل	7	to get wet, get damp
1781	إنبَنى	يِنبَنى	انبنى	ينبنى	7	to be built
1782	إنتَبَه	يِنتِبَه	انتبه	ينتبه	7	to pay attention, notice, watch out, be careful
1783	إنتَحَر	يِنتحَر	انتحر	ينتحر	7	to commit suicide
1784	إنتَخَب	يِنتَخَب	انتخب	ينتخب	7	to vote for, to elect
1785	إنتَسى	يِنتَسى	انتسى	ينتسى	7	to be forgotten
1786	إنتَشَر	يِنتشَر	انتشر	ينتشر	7	to spread (intrans), be published
1787	إنتَصَر	يِنتَصَر	انتصر	ينتصر	7	to be victorious, win (war)
1788	إنتَظَر	يِنتَظَر	انتظر	ينتظر	7	to wait, await
1789	إنتَعَش	يِنتَعَش	انتعش	ينتعش	7	to recover, revive, feel refreshed, feel invigorated
1790	إنتَفَخ	يِنتفَخ	انتفخ	ينتفخ	7	to inflate (intrans), become inflated
1791	إنتَقَد	يِنتَقَد	انتقد	ينتقد	7	to criticize, be critical
1792	إنتَقَل	يِنتقَل	انتقل	ينتقل	7	to move, move on, transfer, relocate (all intrans), be transferred
1793	إنتَقَم	يِنتقَم	انتقم	ينتقم	7	to take revenge, be avenged, avenge oneself
1794	إنتَكَس	يِنتكَس	انتكس	ينتكس	7	to relapse
1795	إنتَلى	يِنتلي	انتلى	ينتلي	7	to fill up (intrans), become full
1796	إنتَمى	يِنتَمي	انتمى	ينتمي	7	to belong, to be related
1797	إنتَهَز	يِنتهَز	انتهز	ينتهز	7	to make good use of, take advantage of, to sieze (an opportinity)
1798	إنتَهى	يِنتهي	انتهى	ينتهي	7	to end (intrans), finish (intrans), come to an end, be over, be up
1799	إنجَبَر	يِنَجبَر	انجبر	ينجبر	7	to be forced, be obliged, have to
1800	إنجَذَب	يِنجَذَب	انجذب	ينجذب	7	to be attracted
1801	إنجّرّ	يِنجَرّ	انجر	ينجر	7	to be dragged, be pulled along
1802	إنجَرَح	يِنَجرَح	انجرح	ينجرح	7	to get hurt, be wounded, get injured, be offended
1803	إنجَرَف	يِنجَرَف	انجرف	ينجرف	7	to be swept away, get carried away (also metaphorical)
1804	إنجَنّ	يِنجَنّ	انجن	ينجن	7	to go insane
1805	إنحاز	يِنحاز	انحاز	ينحاز	7	to take sides
1806	إنحَرَف	يِنحَرَف	انحرف	ينحرف	7	to deviate, turn aside, be led astray, go off the rails
1807	إنحَرَق	يِنحرَق	انحرق	ينحرق	7	to burn, get burned, be burned
1808	إنحَشى	يِنحَشى	انحشى	ينحشى	7	to be stuffed
1809	إنحَكَم	يِنحَكَم	انحكم	ينحكم	7	to be sentenced
1810	إنحَكى	يِنحَكى	انحكى	ينحكى	7	to be spoken, be told, be related, be expressed
1811	إنحَلّ	يِنحَلّ	انحل	ينحل	7	to be solved, to come untied, come unraveled
1812	إنخَرَب	يِنَخرَب	انخرب	ينخرب	7	to be destroyed, be ruined
1813	إنخَفَض	يِنخَفَض	انخفض	ينخفض	7	to drop, decrease, be reduced (intrans)
1814	إنخَمَد	يِنخَمَد	انخمد	ينخمد	7	to calm down (intrans), to subside, die down
1815	إندَبّ	يِندَبّ	اندب	يندب	7	to fall over, fall down
1816	إندَعَك	يِندَعَك	اندعك	يندعك	7	to have a hard time, go through a lot
1817	إندَمَج	يِندَمَج	اندمج	يندمج	7	to fit in, integrate, become part of, be absorbed
1818	إندَهَس	يِنَدهَس	اندهس	يندهس	7	to get run over, to get knocked down
1819	إندَهَش	يِنَدهَش	اندهش	يندهش	7	to be amazed
1820	إندَهَك	يِنَدهَك	اندهك	يندهك	7	to get run over, get knocked down (by a vehicle)
1821	إندَوَش	يِنَدوَش	اندوش	يندوش	7	to become bewildered, get flustered
1822	إنذاع	يِنذاع	انذاع	ينذاع	7	to be broadcast
1823	إنزار	يِنزار	انزار	ينزار	7	to be visited, recieve a visit
1824	إنزَرَع	يِنزَرَع	انزرع	ينزرع	7	to be sown (seed, land, etc)
1825	إنزَلَق	يِنزَلَق	انزلق	ينزلق	7	to slip, slide, glide
1826	إنسَحَب	يِنسَحَب	انسحب	ينسحب	7	to retreat, withdraw
1827	إنسَدّ	يِنسَدّ	انسد	ينسد	7	to be blocked, get blocked up
1828	إنسَرَق	يِنَسرَق	انسرق	ينسرق	7	to be stolen, get stolen, be robbed
1829	إنسَطَل	يِنَسطَل	انسطل	ينسطل	7	to become confused, become dazed / groggy (from shock, alcohol, etc)
1830	إنشاف	يِنشاف	انشاف	ينشاف	7	to be seen, be visible
1831	إنشَدّ	يِنشَدّ	انشد	ينشد	7	to be tightened, pulled tight, become taut
1832	إنشَعَط	يِنشَعَط	انشعط	ينشعط	7	to burn (intrans), get burned
1833	إنشَغَل	يِنَشغَل	انشغل	ينشغل	7	to be busy, be occupied
1834	إنشَقّ	يِنشَقّ	انشق	ينشق	7	to be split
1835	إنصَمَط	يِنصَمَط	انصمط	ينصمط	7	to burn oneself, get burned
1836	إنضَرَب	يِنضَرَب	انضرب	ينضرب	7	to get hit, get beated up, get knocked, get dented
1837	إنضَمّ	يِنضَمّ	انضم	ينضم	7	to join, become a part of
1838	إنطاق	يِنطاق	انطاق	ينطاق	7	to be bearable
1839	إنطَخ	يِنطَخ	انطخ	ينطخ	7	to get shot
1840	إنطَعَج	يِنَطعَج	انطعج	ينطعج	7	to bend (intrans), become bent
1841	إنطَفى	يِنطَفي	انطفى	ينطفي	7	to go out, be extinguished
1842	إنطَوى	يِنَطوي	انطوى	ينطوي	7	to fold (intrans), become folded
1843	إنظَلَم	يِنظَلَم	انظلم	ينظلم	7	to be oppressed, be treated unjustly
1844	إنعَدّ	يِنعَدّ	انعد	ينعد	7	to be counted, be calculated, to be considered, be reckoned, to count as
1845	إنعَدى	يِنَعدي	انعدى	ينعدي	7	to become infected, catch (an illness)
1846	إنعَرَض	يِنعَرَض	انعرض	ينعرض	7	to be shown, be presented, be exhibited
1847	إنعَكَس	يِنعَكَس	انعكس	ينعكس	7	to be reflected
1848	إنعَمَل	يِنعَمَل	انعمل	ينعمل	7	to be done, get done
1849	إنعَمى	يِنَعمي	انعمى	ينعمي	7	to go blind, be dazzled, be blinded
1850	إنعَوَر	يِنَعوَر	انعور	ينعور	7	to lose an eye, become blind in one eye
1851	إنغَسَل	يِنَغسَل	انغسل	ينغسل	7	to be washed / laundered
1852	إنغَصَب	يِنَغصَب	انغصب	ينغصب	7	to be forced, to be raped
1853	إنغَلى	يِنغَلى	انغلى	ينغلى	7	to be boiled
1854	إنفَتَح	يِنَفتَح	انفتح	ينفتح	7	to open (intrans), be opened
1855	إنفَحَص	يِنفَحَص	انفحص	ينفحص	7	to be examined
1856	إنفَرَد	يِبفَرَد	انفرد	يبفرد	7	to be unique, be alone, be seperate, be isolated
1857	إنفَرَط	يِنفَرَط	انفرط	ينفرط	7	to fall apart, come to pieces, to unravel, fray
1858	إنفَصَل	يِنفَصَل	انفصل	ينفصل	7	to part, to be separated
1859	إنفَطَم	يِنَفطَم	انفطم	ينفطم	7	to be weaned
1860	إنفَعَص	يِنَفعَص	انفعص	ينفعص	7	to get squashed, get crushed, get run over
1861	إنفَعَل	يِنفَعَل	انفعل	ينفعل	7	to be excited, be agitated
1862	إنفَكّ	يِنفَكّ	انفك	ينفك	7	to come undone, come untied, come apart, to come loose, to get dislocated
1863	إنقال	يِنقال	انقال	ينقال	7	to be said
1864	إنقَبَل	يِنَقبَل	انقبل	ينقبل	7	to get accepted, be recieved
1865	إنقَتَل	يِنقَتَل	انقتل	ينقتل	7	to be killed
1866	إنقَرى	يِنقَرى	انقرى	ينقرى	7	to be read, be legible
1867	إنقَطَع	يِنَقطَع	انقطع	ينقطع	7	to break (intrans), to be interrupted, get disconnected, to detatch from, cut oneself off from, stay away from, cut ties with
1868	إنقَلَب	يِنَقلَب	انقلب	ينقلب	7	to overturn, capsize, turn inside out
1869	إنقَلَع	يِنَقلَع	انقلع	ينقلع	7	to get pulled out, get torn, get uprooted
